{
  "$schema": "../schemas/powershell.schema.json",
  "projectName": "My Project",
  "rootDir": ".",
  "backendDir": "backend",
  "frontendDir": ".",
  "distDir": "dist",
  "targetDir": "backend/frontend/dist",
  "dataDir": "backend/data",
  "ports": [8080],
  "prerequisites": {
    "go": true,
    "node": true,
    "pnpm": true
  },
  "usePnp": true,
  "pnpmStorePath": "E:/.pnpm-store",
  "cleanPaths": [
    "node_modules",
    "dist",
    ".vite",
    ".pnp.cjs",
    ".pnp.loader.mjs",
    "backend/data/*.db",
    "backend/data/*.db-shm",
    "backend/data/*.db-wal"
  ],
  "buildCommand": "pnpm run build",
  "installCommand": "pnpm install",
  "runCommand": "go run cmd/server/main.go",
  "configFile": "config.json",
  "configExampleFile": "config.example.json",
  "requiredModules": [
    "react",
    "react-dom"
  ],
  "env": {
    "NODE_ENV": "production"
  }
}
